{
  "schemaVersion": 1,
  "scenarioId": "EV-08",
  "runId": "11111111-1111-4111-8111-111111111111",
  "analysisReportId": "22222222-2222-4222-8222-222222222222",
  "codeRevision": "aaaaaaaaaaaaaaaaaaaaaaaaaaaaaaaaaaaaaaaa",
  "inputFingerprint": "bbbbbbbbbbbbbbbbbbbbbbbbbbbbbbbbbbbbbbbbbbbbbbbbbbbbbbbbbbbbbbbb",
  "promptRevision": "sha256:cccccccccccccccccccccccccccccccccccccccccccccccccccccccccccccccc",
  "intentAnchors": [
    {
      "anchorId": "offline-inventory-and-conflicts",
      "origin": "user",
      "statement": "志愿者能离线登记库存变化，并在重连后理解和处理冲突。",
      "evidenceLocations": [
        { "source": "codex_session", "sourceId": "fictional-session-a", "location": "message-1" }
      ],
      "coverage": "covered",
      "suggestionIds": ["33333333-3333-4333-8333-333333333333"],
      "note": "The first suggestion retains the user's goal and tradeoff."
    }
  ],
  "excludedTasks": [
    {
      "description": "运行发布构建并检查一个同步函数。",
      "evidenceLocations": [
        { "source": "codex_session", "sourceId": "fictional-session-b", "location": "message-1" }
      ]
    }
  ],
  "cards": [
    {
      "suggestionId": "33333333-3333-4333-8333-333333333333",
      "suggestionFingerprint": "dddddddddddddddddddddddddddddddddddddddddddddddddddddddddddddddd",
      "matchedAnchorIds": ["offline-inventory-and-conflicts"],
      "evidenceLocations": [
        { "source": "codex_session", "sourceId": "fictional-session-a", "location": "message-1" }
      ],
      "comparedFocusIds": [],
      "judgments": [
        {
          "reviewerAlias": "fictional-reviewer",
          "reviewedAt": "2026-09-28T00:00:00.000Z",
          "rubric": { "concern": "pass", "standalone": "pass", "evidence": "pass", "distinct": "pass", "criticalFailure": false },
          "notes": {
            "concern": "Keeps offline stock changes and conflict review as one lasting concern.",
            "standalone": "Names SeedShelf, the volunteers, and the inventory use case.",
            "evidence": "The selected user message states both needs.",
            "distinct": "The existing plant-metadata card covers a different angle."
          }
        }
      ],
      "finalRubric": { "concern": "pass", "standalone": "pass", "evidence": "pass", "distinct": "pass", "criticalFailure": false }
    },
    {
      "suggestionId": "44444444-4444-4444-8444-444444444444",
      "suggestionFingerprint": "eeeeeeeeeeeeeeeeeeeeeeeeeeeeeeeeeeeeeeeeeeeeeeeeeeeeeeeeeeeeeeee",
      "matchedAnchorIds": [],
      "evidenceLocations": [
        { "source": "codex_session", "sourceId": "fictional-session-b", "location": "message-1" }
      ],
      "comparedFocusIds": [],
      "judgments": [
        {
          "reviewerAlias": "fictional-reviewer",
          "reviewedAt": "2026-09-28T00:00:00.000Z",
          "rubric": { "concern": "fail", "standalone": "fail", "evidence": "pass", "distinct": "pass", "criticalFailure": false },
          "notes": {
            "concern": "This is a release instruction, not a durable interest.",
            "standalone": "The file path and command require the original task context.",
            "evidence": "The quoted user message does contain the one-off instruction.",
            "distinct": "It does not repeat another suggestion."
          }
        }
      ],
      "finalRubric": { "concern": "fail", "standalone": "fail", "evidence": "pass", "distinct": "pass", "criticalFailure": false }
    }
  ],
  "overall": {
    "status": "failed",
    "decidedAt": "2026-09-28T00:00:00.000Z",
    "note": "The durable concern is covered, but the report also proposes a one-off release task."
  }
}
